<?xml version="1.0" encoding="UTF-8"?>

<!--
SPDX-FileCopyrightText: 2023 Antoine Belvire
SPDX-License-Identifier: GPL-3.0-or-later
-->

<tns:dictionary xmlns:tns="http://www.example.org/dictionary" xmlns:xsi="http://www.w3.org/2001/XMLSchema-instance" xsi:schemaLocation="http://www.example.org/dictionary dictionary.xsd ">
    <locale>en</locale>
    <name>Dictionary example</name>
    <name xml:lang="fr-FR">Exemple de dictionnaire</name>
    <description>An example of XML dictionary. Useful for discovery and testing purposes.</description>
    <description xml:lang="fr-FR">Un exemple de dictionnaire. Utile à des fins de découverte et de tests.</description>
    <words>
        <word>Hello</word>
        <word>World</word>
    </words>
</tns:dictionary>
